{
  "$schema": "https://json-schema.org/draft/2020-12/schema",
  "$id": "https://chargesentinel.local/schemas/recommendation_output.schema.json",
  "title": "Charger recommendation output",
  "type": "object",
  "additionalProperties": false,
  "required": ["recommended_charger", "location", "expected_free_time", "expected_wait_minutes", "recommended_slot", "model_version", "score", "score_components", "mock_signals_used", "free_pool_restricted", "reason", "alternatives", "bundle_version", "config_version", "schema_version", "risk_source", "limitations"],
  "properties": {
    "recommended_charger": {"type": ["string", "null"]},
    "location": {"type": ["string", "null"]},
    "expected_free_time": {"type": ["string", "null"], "pattern": "^\\d{4}-\\d{2}-\\d{2}T\\d{2}:\\d{2}:\\d{2}(\\.\\d+)?([+-]\\d{2}:\\d{2}|Z)?$"},
    "expected_wait_minutes": {"type": "number", "minimum": 0},
    "recommended_slot": {"type": ["string", "null"], "pattern": "^\\d{4}-\\d{2}-\\d{2}T\\d{2}:\\d{2}:\\d{2}(\\.\\d+)?([+-]\\d{2}:\\d{2}|Z)?$"},
    "model_version": {"type": "string"},
    "bundle_version": {"type": "string", "minLength": 1},
    "config_version": {"type": "string", "minLength": 1},
    "schema_version": {"const": "recommendation-output-v1"},
    "risk_source": {"enum": ["historical_abnormal_rate", "person3_score"]},
    "signal_sources": {
      "type": "object",
      "additionalProperties": false,
      "required": ["demand_pressure", "solar_benefit", "anomaly_risk"],
      "properties": {
        "demand_pressure": {"type": "string"},
        "solar_benefit": {"type": "string"},
        "anomaly_risk": {"type": "string"}
      }
    },
    "candidate_eligibility": {
      "type": "array",
      "items": {
        "type": "object",
        "additionalProperties": false,
        "required": ["candidate_index", "charger_id", "location", "eligible", "reason"],
        "properties": {
          "candidate_index": {"type": "integer", "minimum": 0},
          "charger_id": {"type": "string"},
          "location": {"type": ["string", "null"]},
          "eligible": {"type": "boolean"},
          "reason": {"type": "string", "minLength": 1},
          "expected_wait_minutes": {"type": "number", "minimum": 0}
        }
      }
    },
    "decision_explanation": {
      "type": "object",
      "additionalProperties": false,
      "required": ["selected_charger_id", "selection_rule", "score_direction", "score_formula", "summary"],
      "properties": {
        "selected_charger_id": {"type": ["string", "null"]},
        "selection_rule": {"type": "string", "minLength": 1},
        "score_direction": {"const": "lower_is_better"},
        "score_formula": {"type": "string", "minLength": 1},
        "summary": {"type": "string", "minLength": 1}
      }
    },
    "limitations": {"type": "array", "items": {"type": "string", "minLength": 1}},
    "explanation": {"$ref": "#/$defs/scoreExplanation"},
    "comparison": {"$ref": "#/$defs/comparison"},
    "score": {"type": ["number", "null"]},
    "score_components": {
      "type": ["object", "null"],
      "additionalProperties": false,
      "required": ["wait", "anomaly_risk", "demand_pressure", "solar_benefit"],
      "properties": {
        "wait": {"type": "number", "minimum": 0, "maximum": 1},
        "anomaly_risk": {"type": "number", "minimum": 0, "maximum": 1},
        "demand_pressure": {"type": "number", "minimum": 0, "maximum": 1},
        "solar_benefit": {"type": "number", "minimum": 0, "maximum": 1}
      }
    },
    "mock_signals_used": {"type": "boolean"},
    "free_pool_restricted": {"type": "boolean"},
    "reason": {"type": "array", "items": {"type": "string"}},
    "alternatives": {"type": "array", "items": {"$ref": "#/$defs/alternative"}}
  },
  "$defs": {
    "scoreExplanation": {
      "type": "object",
      "additionalProperties": false,
      "required": ["terms", "weights", "weighted_terms", "score", "dominant_factor", "reason"],
      "properties": {
        "terms": {"$ref": "#/$defs/scoreTerms"},
        "weights": {"$ref": "#/$defs/scoreTerms"},
        "weighted_terms": {
          "type": "object", "additionalProperties": false,
          "required": ["wait", "anomaly_risk", "demand_pressure", "solar_benefit"],
          "properties": {
            "wait": {"type": "number", "minimum": 0},
            "anomaly_risk": {"type": "number", "minimum": 0},
            "demand_pressure": {"type": "number", "minimum": 0},
            "solar_benefit": {"type": "number", "maximum": 0}
          }
        },
        "score": {"type": "number"},
        "dominant_factor": {"enum": ["wait", "anomaly_risk", "demand_pressure", "solar_benefit"]},
        "reason": {"type": "string", "minLength": 1}
      }
    },
    "scoreTerms": {
      "type": "object", "additionalProperties": false,
      "required": ["wait", "anomaly_risk", "demand_pressure", "solar_benefit"],
      "properties": {
        "wait": {"type": "number", "minimum": 0, "maximum": 1},
        "anomaly_risk": {"type": "number", "minimum": 0, "maximum": 1},
        "demand_pressure": {"type": "number", "minimum": 0, "maximum": 1},
        "solar_benefit": {"type": "number", "minimum": 0, "maximum": 1}
      }
    },
    "comparison": {
      "type": "object", "additionalProperties": false,
      "required": ["second_charger_id", "decisive_term", "reason"],
      "properties": {
        "second_charger_id": {"type": "string"},
        "decisive_term": {"enum": ["wait", "anomaly_risk", "demand_pressure", "solar_benefit"]},
        "reason": {"type": "string", "minLength": 1}
      }
    },
    "alternative": {
      "type": "object",
      "required": ["charger_id", "location", "expected_free_time", "expected_wait_minutes", "recommended_slot", "score", "score_components", "mock_signals_used", "reason", "risk_source"],
      "properties": {
        "charger_id": {"type": "string"},
        "location": {"type": ["string", "null"]},
        "expected_free_time": {"type": "string", "pattern": "^\\d{4}-\\d{2}-\\d{2}T\\d{2}:\\d{2}:\\d{2}(\\.\\d+)?([+-]\\d{2}:\\d{2}|Z)?$"},
        "expected_wait_minutes": {"type": "number", "minimum": 0},
        "recommended_slot": {"type": "string", "pattern": "^\\d{4}-\\d{2}-\\d{2}T\\d{2}:\\d{2}:\\d{2}(\\.\\d+)?([+-]\\d{2}:\\d{2}|Z)?$"},
        "score": {"type": "number"},
        "score_components": {"type": "object"},
        "risk_source": {"enum": ["historical_abnormal_rate", "person3_score"]},
        "explanation": {"$ref": "#/$defs/scoreExplanation"},
        "mock_signals_used": {"type": "boolean"},
        "reason": {"type": "array", "items": {"type": "string"}}
      }
    }
  }
}
